SWAP COUNTERPARTY &REFERENCE OBLIGATION,BUY/SELLPROTECTION,NOTIONALAMOUNT(000 S),PAY/RECEIVEFIXED RATE,TERMINATIONDATE,UNREALIZEDAPPRECIATION(DEPRECIATION),CIK,Reporting Type,Report Year
Goldman Sachs InternationalHartford Financial Services Group Inc.,Buy,650000,0.12  %,"December  20,  2011","
														(405",0000932843,N-CSR,07
Goldman Sachs InternatinalLehman Brothers Holdings Inc.,Buy,650000,0.20,"December  20,  2011",628,0000932843,N-CSR,07
Goldman Sachs InternationalSouthwest Airlines Co.,Buy,700000,0.22,"December  20,  2011","2,888",0000932843,N-CSR,07
"Goldman Sachs InternationalMotorola, Inc.",Buy,220000,0.15,"December  20,  2011","2,346",0000932843,N-CSR,07
"Goldman Sachs InternationalMotorola, Inc.",Buy,450000,0.157,"December  20,  2011","4,662",0000932843,N-CSR,07
Goldman Sachs InternationalUnion Pacific Corporation,Buy,650000,0.20,"December  20,  2011",714,0000932843,N-CSR,07
"Citibank, N.A., New YorkTyco International Ltd.",Buy,780000,0.43,"March  20,  2012",348,0000932843,N-CSR,07
"Citibank, N.A., New YorkTyco International Ltd.",Buy,400000,0.43,"March  20,  2012",178,0000932843,N-CSR,07
Goldman Sachs InternationalChubb Corp.,Buy,650000,0.10,"March  20,  2012",,0000932843,N-CSR,07
